sentence	label
but harper himself is a suspect in several bomb attacks , one of which killed rachel's partner and friend . 	1
in a fantasy life she lives through her sketchbook , laura's world is exotic , bright and enchanting . 	1
kilo decides to learn how to prosper in the drug world and his new life as a dealer begins . 	1
he has had no formal education , but on his own , he systematically studies western theories of industrial management and such classical chinese philosophies as confucianism , taoism , and suntzu . 	1
in addition , the detective has to deal with a serial killer who had already killed and mutilated many women . 	1
at times he seems to share nicholas's fascination , but then appears more interested in making inroads with the girls at school . 	1
but there are some surprises on the way . . . 	1
the sra's act as 'portals' on the internet , helping users to fulfill their dreams . 	1
they discover a little bit about love , dating and each other as the search through the thousands of hopefuls . 	1
a zany comedy where as pop is dying he is pushing his remaining son to fulfill his last request ; to marry and carry on the family name . 	1
his father and brother are dead for so many years . 	1
as the girls begin to bond , laura gradually begins to find herself abandoning the safety of the fantasy and falling into her first real friendship . 	1
unwilling to disappoint his proud mother , morales wastes no time in looking for a job to pay his way through school . 	1
the land has been in the grip of a ravaging drought for 10 years . 	1
the story follows them and the people they encounter on their way to their destination . 	1
the movie revolves around munnabhai ( sanjay dutt ) a dreaded but good-hearted underworld don of mumbai . 	1
she calls on a fairy godmother to grants her three wishes . 	1
four characters are carried over , the first sergeant , the clerk , the mess sergent , and the misfit . 	1
she and her daughter flee to find sylvie's first love in the countryside . 	1
to spite the hated infidel ways of her father , she has settled into a complacent relationship and is struggling ( not too hard ) with issues of fidelity to her kind but unexciting husband . 	1
the parent corporation sends in an elite military unit , where they meet alice , who is suffering from amnesia due to exposure to nerve gas . 	1
his search soon sends him down a dangerous path . . . 	1
together , they plan to build their definite house over land that belonged to gregorio's grandfather , but little does the rest of the family suspect that beneath the terrain there is a huge number of weapons buried by gregorio during his youth . 	1
they came to pray , but instead they end up in the middle of an unpleasant religious argument as they suddenly get interrupted by a mystical appearance : is it god ? 	1
ahas , son from a poor family , in his inner struggles , joins the troop of his classmates and heads for the front . 	1
this definitely delivers a remarkable mixture of explosive drama with wickedly ironical humor as you follow this eclectic story surrounding this tide-dyed , free spirited couple's showdown with a mysterious faberge' egg and a seedy , well-woven cast of criminals that will both trill and amuse . 	1
during the war between iran and iraq , a group of iranian kurd musicians set off on an almost impossible mission . 	1
it's valentines day , sweets are currency , and new yorkers can't seem to get enough of their favorite moses donuts . 	1
former world-rallye-champion walter and his daughter natascha are kidnapped by arab terrorists and brought to berlin . 	1
but things take a turn for the worst when sheldon finds out that some of the people that he works with , and some he doesn't know he's working for , are all in it for the money . 	1
the word in las vegas is that he is dead . 	1
and in wicker park ( chicago's answer to greenwich village ) , rachel is about to meet her cosmic match . 	1
leviticus , a navy veteran returns home after serving his country to find the war at home is harder than anything he's ever encountered , but exactly what &#38 ; who is he fighting for ? 	1
but then the crew detects a break-in on their computer systems , and picard is captured by the romulans because shinzon needs him as his only matching supplier of genetic material . 	1
all of this changes when he finds a large mysterious package left on his doorstep . 	1
this appears to be only the beginning of a string of suicides around the country . 	1
they swore to have their unborn babies get married when they grew up . 	1
after their relationship falters , shane begins to think he might be unlucky and turns to gambling as an outlet for his obsession . 	1
ben cronin has it all : the admiration of his many friends , a terrific girlfriend , and he's on the fast-track to an athletic scholarship . 	1
"sebastien cortez is an up and coming film maker who has just gotten his big break in "" the biz . "" "	1
having an affair with his girlfriend's professor forces him to make difficult decisions about love , friendship , career , and the direction his life should take . 	1
meanwhile , on jesse&#180 ; s trail is the saint of the killers , a holy cowboy assassin with the mission of kill custer . 	1
"swept into the final moments of the ceremony , jenny must decide ; should she hurt all the people who love her by running away , or simply say "" i do "" ? "	1
how does it play a significant role in japanese culture , and why does it fascinate american youth ? 	1
the artist lives alone in a foreboding old house in the country , a place of solitude , free from distractions . 	1
over 80 of the world's greatest martial artists demonstrate techniques and discuss philosophy in this fascinating account of the martial arts phenomenon and its increasing global popularity . 	1
conflict enters their relationship when anthony expresses to victoria that their sex life is practically non-existent . 	1
and yet , amid the overwhelming destitution and the daily quest for survival , the desire for joy , beauty and music is still alive . 	1
he is locked up in a chinese prison where he is guilty until proven innocent . 	1
standard story of boy meets girl and girl thinks he is gay . 	1
adam fields is a rage-filled u . s . border patrol agent who often crosses the line in his job . 	1
then you remember where the bad dreams came from . 	1
brings back nick tellis , fired 18-months ago when a stray bullet hits a pregnant woman . 	1
while awaiting trial , zoe is confined to house arrest , where she alternates falling in love with her frequent visitor and parole officer , daly , and trying to prove her innocence to regain her life and freedom . 	1
in order to preserve her art and also herself , beyond death , for all posterity , she has herself cloned . 	1
he indeed is douglas ( timothy bottoms ) , a perfect look-a-like . 	1
juwanna mann follows the story of jamal jeffries ( miguel a . nunez , jr . ) , the reigning 'bad boy' of basketball , whose undisciplined on-court antics land him out of the league and without any prospects . 	1
"the five protagonists of my film are women who have not been able to organize the large "" stones "" in their lives . "	1
her harrowing story ends in victory , but she has not forgotten the thousands of asylum seekers who remain in detention today . 	1
an unusual family and a staff of two are preparing a party on their cosy mansion . 	1
" "" bums in the mist "" will expose you to a world where alcohol is king and sloth is a virtue ; buddy george will discover , bums who are able to find love and professional success all while maintaining their "" mondern frontiersman "" lifestyle ; bums who's natural gifts enable them to move down the ladder of success at an astronomical rate ( or whatever the opposite of astronomical is ) and who's penchant for violence impact every aspect of their lives . "	1
unfortunately the third seems out of reach - the beautiful , seductive anne elise . 	1
gerry's daughter , mattie , accidentally prints out a dna code that in the wrong hands can end the human race . 	1
devastated by her husband's death from a drug overdose , philippa ( played by cate blanchett ) , a british teacher living in turin , italy , tries to bring justice to the biggest drug dealer in turin when the local police ignore her information about him . 	1
"ex-special forces operator frank martin ( jason statham ) lives what seems to be a quiet life along the french mediterranean , hiring himself out as a mercenary "" transporter "" who moves goods - human or otherwise - from one place to another . "	1
upon sighting a small , previously not there , diner , he pulls in to find help . 	1
simon is desperately trying to save his internet personals business . 	1
"a coming of age dramatic comedy dealing with the effect that two "" summers "" have on the lives of several teenagers . "	1
jack must then put his life in the hands of a series of characters that he just cannot seem to trust - for good reason , they lead him to a fate that jack could never have suspected - a tongue-in-check send-up of a classic urban myth . 	1
the movie introduces us to frankie ( played by david eigenberg ) a would-be romeo who will put himself though great pains to find his juliet . 	1
the friends may listen , but when do they learn maybe never or only when the journey begins with you . 	1
but what if it's lord voldemort trying to make his evil return ? 	1
their letter has been received in whitehall and merton corroborates their heroic story . 	1
their parents , miffed by this , decide to go and kidnap st . nick , unaware that their plan will soon backfire upon them in fun and happy ways . 	1
no one knows this better than 35-year-old vince , back in his hometown of van wert , ohio , after a 13-year absence . 	1
when his mom named him after warren beatty . . . 	1
tom , a spaniard , is married to sylvie and lives a quiet but a bit boring life in the britanny countryside ( west of france ) . 	1
he must do this in secret so that the parents and school personnel know nothing of his plan . 	1
{esther buffy} a young vibrant chinese american female who desperately tries to please her strict parents along the way of trying to find herself . 	1
when a ship sinks off the coast of argentina , ellen brachman , a clever and ambitious claims assessor for the rotterdam marine-insurance company european hayward , suspects a 'sinker' . 	1
then there's nicole , who gets her orgasmic intimacy watching chan every night . 	1
set during the cull of the stray dogs in the city of bucharest , the wild dogs weaves together a week in the lives of several citizens of and visitors to the hauntingly beautiful city . 	1
while treating a homicide detective for smoking , hypnotherapist michael strother has a telepathic vision of a young girl floating beneath the surface of a stream . 	1
everything is set for the perfect weekend , until one of the guests stumbles across an old history of the house with the power to unleash the horrors of scotland's past . 	1
behind every suicide bombing there is at least one human story that ends , the story of the suicide bomber . 	1
steve's best friend , sean , on the other hand , hasn't been so lucky . 	1
partnered with the sassy , stunning sistah girl , our hero must first undergo the ultimate attitude adjustment and trade in his 'fro and platforms for tennis sweaters and penny loafers . 	1
his house , container of lives and memories , is closed and locked . 	1
meanwhile , paro , on the other hand , performed her worldly duties sincerely , but inside her heart , she could never forget devdas for a moment . 	1
until then , he spends most of his time watching sloppy tearjerkers on video . 	1
this film is a prequel to all of the the house of the dead video games . 	1
as in his previous films , this kurdish director is again focusing on the oppression of his people . 	1
scott was on his way to work shooting a documentary in midtown manhattan on september 11th . 	1
a group of hi-tech troops are sent in to destroy the red dimension where the tall man gets his power , reggie ( reggie bannister ) follows so he can find mike ( a . 	1
ever have one of those lifetimes where nothing seems to go right ? 	1
paramount to her world is gene , a wealthy disturbed businessman who has slowly become her benefactor over the years . 	1
will superfag save the world from peckerhead's evil diabolical plan ? 	1
these divisions of play into gender roles cause the girls to start talking as if they were sociologists and psychologists discussing learned behaviors . 	1
the brass want to close out the case , nick and henry stay on it , and bits of evidence point them to an auto body shop . 	1
"see rare footage of some of the world's greatest kickboxers such as benny "" the jet "" urquidez , don "" the dragon wilson and bill "" superfoot "" wallace . "	1
when two african american pilots become the first non-white soldiers in the camp , one turns up murdered and the other accused of killing a white sergeant . 	1
he reluctantly agrees to protect a child , pinta balletto ( fanning ) , whose parents are threatened by a rash of kidnappings . 	1
it becomes a harder choice than one might think . 	1
this startling film provides a gritty look into american politics in the new south . 	1
the internment of 120 , 000 innocent people was a dark moment in the history of this country . 	1
she tells him , and they go to the sonogram appointment together . 	1
billy is more a showbiz p . r agent than a legal lawyer and minipulates the tabloids into thinking roxie is no more than an innocent 'good time girl' who took the wrong path , than a scheming murderess . 	1
to ease their roommate ( selma blair ) through a relationship-induced depression , cameron diaz and christina applegate take her out on the town . 	1
shows that you should not fear death , but to fear an unlived life . 	1
each has their reason for wanting to be there - fame , money , adventure . 	1
when his sister meets a grisly death in san francisco , he goes there to hunt her killer . 	1
ray misses a chance to see his brother paul before he dies of cancer . 	1
principle photography began in july 1999 when the band , bering strait , entered the united states and began recording their first album in nashville . 	1
daniel soon gets his chance to find out when the basement floods and his mother insists daniel share his bedroom with robert while the plumbers fix the mess downstairs . . . 	1
in flashbacks that parallel his investigation , we see alicia , a scholarship girl worried about her grades , gradually pulled into the social life of three rich and amoral young women , led by the blond hadley , a femme fatale . 	1
nsa agent gibbons ( samuel l . jackson ) forces xxx to cooperate with the government to infiltrate an underground russian crime ring and avoid going to prison . 	1
in a fit of desperation he challenges god and vents that if only he had god's power , he could solve all his problems . 	1